{
  "schema_version": "1.1",
  "namespace": "integration_tests",
  "integration_test": true,
  "evidence_id": "sample-cs-generated",
  "subject": "cs-ai",
  "concept": "Generated binary search",
  "task_type": "CODING",
  "occurred_at": "2026-01-01T12:00:00Z",
  "source": "Synthetic human-reviewed example",
  "result": "PASS",
  "independence_class": "ASSISTED",
  "hint_level": 4,
  "agent_usage": "AI_GENERATED",
  "time_spent": 1200,
  "difficulty": "HARD",
  "evidence_refs": [
    "fictional-response"
  ],
  "assessment_context": "TRAINING",
  "readiness_dimensions": [
    "Algorithms"
  ],
  "metadata": {
    "attempt_id": "example-cs-generated",
    "context_id": "example-context"
  },
  "failure_modes": [
    "cs:AI_DEPENDENCE"
  ]
}
